### ISSUE TITLE
approle policy with *_bound_cidr not working

### ISSUE THREAD

**Issue by Masber** [banzaicloud/bank-vaults#1700]
> Bugs should be filed for issues encountered whilst operating bank-vaults.
> You should first attempt to resolve your issues through the community support
> channels, e.g. Slack, in order to rule out individual configuration errors.
> Please provide as much detail as possible.

**Describe the bug**:

Vault sees client IP as 127.0.0.6 which is not the original client IP

**Expected behaviour**:
A concise description of what you expected to happen.

I connect to vault using VPN hence I would expect vault to see the right IP and not a loopback one

**Steps to reproduce the bug**:
Steps to reproduce the bug should be clear and easily reproducible to help people
gain an understanding of the problem.

Enable approle and a policy (with no secret-id needed for authentication)
```
vault auth enable approle

vault policy write manta -<<EOF
# Read-only permission on secrets stored at 'secret/shasta/*'
path "secret/data/shasta/*" {
  capabilities = [ "read" ]
}
EOF

vault write auth/approle/role/manta token_policies="manta" \
    bind_secret_id=false token_ttl=1m token_max_ttl=1m token_bound_cidrs="148.187.134.0/24" secret_id_bound_cidrs="148.187.134.0/24" token_num_uses=5

ROLE_ID=$(vault read auth/approle/role/manta/role-id)

tee payload.json <<"EOF"
{
  "role_id": $ROLE_ID
}
EOF

APP_TOKEN=$(curl --request POST --data @payload.json $VAULT_ADDR/v1/auth/approle/login \
    | jq -r ".auth.client_token")
```

Then try to authenticate

```
curl --request POST --interface vpn0 --data @payload.json $VAULT_ADDR/v1/auth/approle/login
{"errors":["source address \"127.0.0.6\" unauthorized by CIDR restrictions on the role: \u003cnil\u003e"]}
```

According to Vault, the client IP is 127.0.0.6 as the client IP which is not correct

**Additional context**:

These are network logs showing client IP is not 127.0.0.6

```
$ sudo tcpdump -i any host vault.svc.cscs.ch
[sudo] password for msopena: 
tcpdump: verbose output suppressed, use -v or -vv for full protocol decode
listening on any, link-type LINUX_SLL (Linux cooked v1), capture size 262144 bytes
17:05:43.924611 IP vpn-123.cscs.ch.57644 > 148.187.110.224.https: Flags [S], seq 1088860613, win 64680, options [mss 1320,sackOK,TS val 2181086092 ecr 0,nop,wscale 7], length 0
17:05:44.675591 IP 148.187.110.224.https > vpn-123.cscs.ch.57644: Flags [S.], seq 674546642, ack 1088860614, win 65160, options [mss 1300,sackOK,TS val 403348320 ecr 2181086092,nop,wscale 7], length 0
17:05:44.675619 IP vpn-123.cscs.ch.57644 > 148.187.110.224.https: Flags [.], ack 1, win 506, options [nop,nop,TS val 2181086843 ecr 403348320], length 0
17:05:44.685408 IP vpn-123.cscs.ch.57644 > 148.187.110.224.https: Flags [P.], seq 1:518, ack 1, win 506, options [nop,nop,TS val 2181086852 ecr 403348320], length 517
17:05:45.269554 IP 148.187.110.224.https > vpn-123.cscs.ch.57644: Flags [.], ack 518, win 506, options [nop,nop,TS val 403348921 ecr 2181086852], length 0
17:05:45.282117 IP 148.187.110.224.https > vpn-123.cscs.ch.57644: Flags [.], seq 1:1289, ack 518, win 506, options [nop,nop,TS val 403348929 ecr 2181086852], length 1288
17:05:45.282136 IP vpn-123.cscs.ch.57644 > 148.187.110.224.https: Flags [.], ack 1289, win 502, options [nop,nop,TS val 2181087449 ecr 403348929], length 0
17:05:45.282152 IP 148.187.110.224.https > vpn-123.cscs.ch.57644: Flags [P.], seq 1289:2577, ack 518, win 506, options [nop,nop,TS val 403348929 ecr 2181086852], length 1288
17:05:46.517052 IP 148.187.110.224.https > vpn-123.cscs.ch.57644: Flags [.], ack 1009, win 506, options [nop,nop,TS val 403350158 ecr 2181088063], length 0
```

**Environment details**:
- Kubernetes version (e.g. v1.10.2):

```
$ kubectl version
Client Version: version.Info{Major:"1", Minor:"22", GitVersion:"v1.22.1", GitCommit:"632ed300f2c34f6d6d15ca4cef3d3c7073412212", GitTreeState:"clean", BuildDate:"2021-08-19T15:45:37Z", GoVersion:"go1.16.7", Compiler:"gc", Platform:"linux/amd64"}
Server Version: version.Info{Major:"1", Minor:"21", GitVersion:"v1.21.4", GitCommit:"3cce4a82b44f032d0cd1a1790e6d2f5a55d20aae", GitTreeState:"clean", BuildDate:"2021-08-11T18:10:22Z", GoVersion:"go1.16.7", Compiler:"gc", Platform:"linux/amd64"}
```

- Cloud-provider/provisioner (e.g. AKS, GKE, EKS, PKE etc):

K8s local installation (vanilla)

- bank-vaults version (e.g. 0.4.17):

> vault-operator-1.14.3 

- Install method (e.g. helm or static manifests):

> helm

- Logs from the misbehaving component (and any other relevant logs):

- Resource definition (possibly in YAML format) that caused the issue, without sensitive data:

/kind bug

**Comment by Masber** [comment]
Apparently this was caused by istio proxy which modifies source IP addess with 127.0.0.6
